{
  "id": "chemistry",
  "locale": "zh-CN",
  "name": "化学",
  "app": {
    "productName": "ClassGame 化学",
    "gameTitle": "趣味化学大闯关",
    "editorTitle": "ClassGame 化学题库编辑器",
    "appUserModelId": "ClassGame.Chemistry"
  },
  "labels": {
    "splashTitle": "🧪 趣味化学大闯关",
    "enterButton": "点击进入系统",
    "homeTitle": "化学闯关大厅",
    "homeDescription": "选择关卡开始挑战，题目和选项每次都会随机排列",
    "chapterSectionTitle": "关卡目录",
    "practiceSectionTitle": "专项练习",
    "chapterMode": "章节闯关",
    "wrongBookTitle": "我的错题本",
    "favoritesTitle": "我的收藏夹",
    "exportButton": "⬇ 导出学习记录",
    "importButton": "⬆ 导入学习记录",
    "autoRemoveOn": "错题答对自动移除：开",
    "autoRemoveOff": "错题答对自动移除：关",
    "resetButton": "🗑 清空记录",
    "gameFrameTitle": "化学答题关卡",
    "editorDescription": "编辑章节、题目与答案，保存后即可在课堂模式中使用。"
  },
  "theme": {
    "primary": "#00C6FF",
    "secondary": "#0072FF",
    "ink": "#19324A",
    "surface": "#FFFFFF",
    "accent": "#FFD43B"
  },
  "assets": {
    "background": "static/images/common/bg.jpg",
    "icon": "static/images/common/app_icon.ico",
    "audio": {
      "bgm": "static/audio/bgm.mp3",
      "correct": "static/audio/correct.mp3",
      "wrong": "static/audio/wrong.mp3",
      "hover": "static/audio/hover.mp3"
    }
  },
  "storageKey": "classgame:chemistry"
}
